title,link
Delhi's 6-Day Lockdown: See What's Allowed,https://news.google.com/articles/CAIiENeFLrEZ99sC8qzN2iywwOYqGQgEKhAIACoHCAowj8n_CjDIrfkCMPGi6AU?hl=en-IN&gl=IN&ceid=IN%3Aen
"New record rise in India’s COVID cases, deaths; curfew in capital",https://news.google.com/articles/CAIiEHgyWhfgxswutBnHZjtXkxQqFAgEKgwIACoFCAowhgIwkDgw0O8B?hl=en-IN&gl=IN&ceid=IN%3Aen
Prime Minister Modi responsible for second wave of Covid-19: Mamata,https://news.google.com/articles/CAIiEEOX3KiYGH0-XmBp-j_ZPuIqGQgEKhAIACoHCAowzrL9CjDC7vQCMK2y1gU?hl=en-IN&gl=IN&ceid=IN%3Aen
India's 'double mutation' covid virus variant is worrying the world,https://news.google.com/articles/CAIiEKb15G7ZCjZ6n02F8fsa5eUqFwgEKg4IACoGCAowxLQ_MNevCDCyrdsG?hl=en-IN&gl=IN&ceid=IN%3Aen
"In reply to Manmohan Singh’s letter on vaccine strategy, Harsh Vardhan slams Congress",https://news.google.com/articles/CAIiEFL9Ey-apoaa_cNHovdIu4MqGAgEKg8IACoHCAow3rvTBDD89X4w8ZXmBQ?hl=en-IN&gl=IN&ceid=IN%3Aen
Boris Johnson's India Visit Next Week Cancelled Due To COVID-19,https://news.google.com/articles/CAIiEF-nSgo8HBmYbuLAEfg-WfMqGQgEKhAIACoHCAowj8n_CjDIrfkCMPGi6AU?hl=en-IN&gl=IN&ceid=IN%3Aen
"In reply to Manmohan Singh’s letter on vaccine strategy, Harsh Vardhan slams Congress",https://news.google.com/articles/CAIiEFL9Ey-apoaa_cNHovdIu4MqGAgEKg8IACoHCAow3rvTBDD89X4w8ZXmBQ?hl=en-IN&gl=IN&ceid=IN%3Aen
"New record rise in India’s COVID cases, deaths; curfew in capital",https://news.google.com/articles/CAIiEHgyWhfgxswutBnHZjtXkxQqFAgEKgwIACoFCAowhgIwkDgw0O8B?hl=en-IN&gl=IN&ceid=IN%3Aen
Delhi's 6-Day Lockdown: See What's Allowed,https://news.google.com/articles/CAIiENeFLrEZ99sC8qzN2iywwOYqGQgEKhAIACoHCAowj8n_CjDIrfkCMPGi6AU?hl=en-IN&gl=IN&ceid=IN%3Aen
Opposition joins calls for Boris Johnson to cancel India visit over new Covid variant,https://news.google.com/articles/CBMihgFodHRwczovL2luZGlhbmV4cHJlc3MuY29tL2FydGljbGUvd29ybGQvb3Bwb3NpdGlvbi1qb2lucy1jYWxscy1mb3ItYm9yaXMtam9obnNvbi10by1jYW5jZWwtaW5kaWEtdmlzaXQtb3Zlci1uZXctY292aWQtdmFyaWFudC03Mjc5MTYzL9IBiwFodHRwczovL2luZGlhbmV4cHJlc3MuY29tL2FydGljbGUvd29ybGQvb3Bwb3NpdGlvbi1qb2lucy1jYWxscy1mb3ItYm9yaXMtam9obnNvbi10by1jYW5jZWwtaW5kaWEtdmlzaXQtb3Zlci1uZXctY292aWQtdmFyaWFudC03Mjc5MTYzL2xpdGUv?hl=en-IN&gl=IN&ceid=IN%3Aen
US warns of consequences if jailed Kremlin critic Navalny dies,https://news.google.com/articles/CCAiC0ljTHozMDZWTVpzmAEB?hl=en-IN&gl=IN&ceid=IN%3Aen
‘In loving memory’: Queen Elizabeth II left handwritten note on Prince Philip’s coffin,https://news.google.com/articles/CAIiEDkiCX4U_qDWqh-FWMd6DB8qGAgEKg8IACoHCAow3rvTBDD89X4w8YzmBQ?hl=en-IN&gl=IN&ceid=IN%3Aen
Pakistan Police And Rangers Taken Hostage In Anti-France Protests,https://news.google.com/articles/CAIiEDuHMkVhyxq8r09FhUCAGoEqGQgEKhAIACoHCAowj8n_CjDIrfkCMPGi6AU?hl=en-IN&gl=IN&ceid=IN%3Aen
‘Tried to get him help’: FedEx mass shooter’s family apologises to victims’ kin,https://news.google.com/articles/CAIiEJesoQNMYS7QskREX6418-YqFggEKg4IACoGCAoww7k_MMevCDDl2wE?hl=en-IN&gl=IN&ceid=IN%3Aen
What should you do with HDFC Bank stock post Q4 earnings?,https://news.google.com/articles/CBMifmh0dHBzOi8vd3d3Lm1vbmV5Y29udHJvbC5jb20vbmV3cy9waG90b3MvYnVzaW5lc3Mvc3RvY2tzL3doYXQtc2hvdWxkLXlvdS1kby13aXRoLWhkZmMtYmFuay1zdG9jay1wb3N0LXE0LWVhcm5pbmdzLTY3ODU1MDEuaHRtbNIBggFodHRwczovL3d3dy5tb25leWNvbnRyb2wuY29tL25ld3MvcGhvdG9zL2J1c2luZXNzL3N0b2Nrcy93aGF0LXNob3VsZC15b3UtZG8td2l0aC1oZGZjLWJhbmstc3RvY2stcG9zdC1xNC1lYXJuaW5ncy02Nzg1NTAxLmh0bWwvYW1w?hl=en-IN&gl=IN&ceid=IN%3Aen
"Gold Price Today, April 19, 2021: Rate Increases Marginally, Silver Remains Unchanged",https://news.google.com/articles/CBMigwFodHRwczovL3d3dy5uZXdzMTguY29tL25ld3MvYnVzaW5lc3MvZ29sZC1wcmljZS10b2RheS1hcHJpbC0xOS0yMDIxLXJhdGUtaW5jcmVhc2VzLW1hcmdpbmFsbHktc2lsdmVyLXJlbWFpbnMtdW5jaGFuZ2VkLTM2NTQyMzkuaHRtbNIBhwFodHRwczovL3d3dy5uZXdzMTguY29tL2FtcC9uZXdzL2J1c2luZXNzL2dvbGQtcHJpY2UtdG9kYXktYXByaWwtMTktMjAyMS1yYXRlLWluY3JlYXNlcy1tYXJnaW5hbGx5LXNpbHZlci1yZW1haW5zLXVuY2hhbmdlZC0zNjU0MjM5Lmh0bWw?hl=en-IN&gl=IN&ceid=IN%3Aen
Citigroup refocuses in asia amid consumer pullback,https://news.google.com/articles/CBMicGh0dHBzOi8vd3d3LmxpdmVtaW50LmNvbS9pbmR1c3RyeS9iYW5raW5nL2NpdGlncm91cC1yZWZvY3VzZXMtaW4tYXNpYS1hbWlkLWNvbnN1bWVyLXB1bGxiYWNrLTExNjE4NjY2MDY5NTgzLmh0bWzSAXRodHRwczovL3d3dy5saXZlbWludC5jb20vaW5kdXN0cnkvYmFua2luZy9jaXRpZ3JvdXAtcmVmb2N1c2VzLWluLWFzaWEtYW1pZC1jb25zdW1lci1wdWxsYmFjay9hbXAtMTE2MTg2NjYwNjk1ODMuaHRtbA?hl=en-IN&gl=IN&ceid=IN%3Aen
"HDFC Bank, Mindtree, Macrotech Developers, PVR, Future Retail among stocks in focus today",https://news.google.com/articles/CAIiENVQR-bASiE3CbsjuaYY93QqGQgEKhAIACoHCAow55veCjDzvdUBMIPh5gU?hl=en-IN&gl=IN&ceid=IN%3Aen
"Oppo A54 India Launch Today: Expected Price, Specifications, and Everything Else You Need to Know",https://news.google.com/articles/CAIiEM2PBeFhmTBIpY39dv5KHJ4qGQgEKhAIACoHCAowgubcCjC2gc8BMN3v1QY?hl=en-IN&gl=IN&ceid=IN%3Aen
New WhatsApp flaw puts users’ data at risk; Check details,https://news.google.com/articles/CAIiEEqBgTVarbAO9qSlCIAjN_oqGAgEKg8IACoHCAow3rvTBDD89X4wsLbmBQ?hl=en-IN&gl=IN&ceid=IN%3Aen
"Realme Q3 Pro specifications spotted on Geekbench: MediaTek Dimensity 1100, 8GB RAM, and more",https://news.google.com/articles/CAIiEGAzUXqSCKCAUQv0FR1mFH8qGQgEKhAIACoHCAowh6GPCzCWsaIDMJaHrgY?hl=en-IN&gl=IN&ceid=IN%3Aen
Poco M2 Reloaded with MediaTek Helio G80 chipset to launch in India on April 21,https://news.google.com/articles/CAIiEOx86SWwpmI1LVCs-m8KrWkqGQgEKhAIACoHCAowot7cCjD8xM4BMJTu8gU?hl=en-IN&gl=IN&ceid=IN%3Aen
"Ranbir Kapoor, Alia Bhatt twin in white, jet off to Maldives post Covid recovery",https://news.google.com/articles/CAIiEHvvzJ7y-V4S8cgKjZ1x2kIqFwgEKg4IACoGCAoww7k_MMevCDC93YUH?hl=en-IN&gl=IN&ceid=IN%3Aen
Rakhi Sawant's mom calls Salman Khan an 'angel' as she undergoes surgery funded by him; mother-daughter t,https://news.google.com/articles/CBMiwwFodHRwczovL3RpbWVzb2ZpbmRpYS5pbmRpYXRpbWVzLmNvbS90di9uZXdzL2hpbmRpL3Jha2hpLXNhd2FudHMtbW9tLWNhbGxzLXNhbG1hbi1raGFuLWFuLWFuZ2VsLWFzLXNoZS11bmRlcmdvZXMtYS1zdXJnZXJ5LWZ1bmRlZC1ieS1oaW0tbW90aGVyLWRhdWdodGVyLXRoYW5rLWhpbS1oZWFydGlseS9hcnRpY2xlc2hvdy84MjEzOTQ1Ni5jbXPSAb4BaHR0cHM6Ly9tLnRpbWVzb2ZpbmRpYS5jb20vdHYvbmV3cy9oaW5kaS9yYWtoaS1zYXdhbnRzLW1vbS1jYWxscy1zYWxtYW4ta2hhbi1hbi1hbmdlbC1hcy1zaGUtdW5kZXJnb2VzLWEtc3VyZ2VyeS1mdW5kZWQtYnktaGltLW1vdGhlci1kYXVnaHRlci10aGFuay1oaW0taGVhcnRpbHkvYW1wX2FydGljbGVzaG93LzgyMTM5NDU2LmNtcw?hl=en-IN&gl=IN&ceid=IN%3Aen
Kangana Ranaut takes us inside her home that she is sharing with her ‘slightly annoying friend’ during weekend curfew,https://news.google.com/articles/CAIiELBdEJGExgrXXeKhesW7riYqGAgEKg8IACoHCAow3rvTBDD89X4woabmBQ?hl=en-IN&gl=IN&ceid=IN%3Aen
Sara Ali Khan And Amrita Singh Fly Off To Maldives 10 images,https://news.google.com/articles/CBMiYmh0dHBzOi8vd3d3Lm5kdHYuY29tL3Bob3Rvcy9lbnRlcnRhaW5tZW50L3NhcmEtYWxpLWtoYW4tYW5kLWFtcml0YS1zaW5naC1mbHktb2ZmLXRvLW1hbGRpdmVzLTk5ODk20gEA?hl=en-IN&gl=IN&ceid=IN%3Aen
IPL 2021: Sanju Samson's New Nickname For Jos Buttler Has Rajasthan Royals Buzzing. Watch,https://news.google.com/articles/CBMijAFodHRwczovL3Nwb3J0cy5uZHR2LmNvbS9pcGwtMjAyMS9pbmRpYW4tcHJlbWllci1sZWFndWUtc2FuanUtc2Ftc29ucy1uZXctbmlja25hbWUtZm9yLWpvcy1idXR0bGVyLWhhcy1yYWphc3RoYW4tcm95YWxzLXNtaWxpbmctd2F0Y2gtMjQxNjk2NtIBoQFodHRwczovL3Nwb3J0cy5uZHR2LmNvbS9pcGwtMjAyMS9pbmRpYW4tcHJlbWllci1sZWFndWUtc2FuanUtc2Ftc29ucy1uZXctbmlja25hbWUtZm9yLWpvcy1idXR0bGVyLWhhcy1yYWphc3RoYW4tcm95YWxzLXNtaWxpbmctd2F0Y2gtMjQxNjk2Nj9hbXA9MSZha2FtYWktcnVtPW9mZg?hl=en-IN&gl=IN&ceid=IN%3Aen
FIFA publish statement about new European Super League,https://news.google.com/articles/CBMiUmh0dHBzOi8vd3d3Lm1hbmFnaW5nbWFkcmlkLmNvbS8yMDIxLzQvMTkvMjIzOTE0NjgvZmlmYS1zdXBlci1sZWFndWUtc3RhdGVtZW50LTIwMjHSAV9odHRwczovL3d3dy5tYW5hZ2luZ21hZHJpZC5jb20vcGxhdGZvcm0vYW1wLzIwMjEvNC8xOS8yMjM5MTQ2OC9maWZhLXN1cGVyLWxlYWd1ZS1zdGF0ZW1lbnQtMjAyMQ?hl=en-IN&gl=IN&ceid=IN%3Aen
"IPL 2021: Match 13, DC vs MI Match Prediction – Who will win today’s match?",https://news.google.com/articles/CAIiEIqBqaIlPfLw9EdBzwa1hBkqGQgEKhAIACoHCAow_sf-CjDt3fYCMKW1pAY?hl=en-IN&gl=IN&ceid=IN%3Aen
Jose Mourinho SACKED by Tottenham Hotspur! Did he lose Spurs' dressing room? | Premier League,https://news.google.com/articles/CCAiC0lDYU52YkphaUJNmAEB?hl=en-IN&gl=IN&ceid=IN%3Aen
NASA's experimental Mars helicopter has taken flight,https://news.google.com/articles/CBMifWh0dHBzOi8vdGltZXNvZmluZGlhLmluZGlhdGltZXMuY29tL2hvbWUvc2NpZW5jZS9uYXNhcy1leHBlcmltZW50YWwtbWFycy1oZWxpY29wdGVyLWhhcy10YWtlbi1mbGlnaHQvYXJ0aWNsZXNob3cvODIxNDQ1NzQuY21z0gF4aHR0cHM6Ly9tLnRpbWVzb2ZpbmRpYS5jb20vaG9tZS9zY2llbmNlL25hc2FzLWV4cGVyaW1lbnRhbC1tYXJzLWhlbGljb3B0ZXItaGFzLXRha2VuLWZsaWdodC9hbXBfYXJ0aWNsZXNob3cvODIxNDQ1NzQuY21z?hl=en-IN&gl=IN&ceid=IN%3Aen
300-Million-Year-Old Godzilla Shark Discovered in New Mexico Gets a New Name,https://news.google.com/articles/CAIiEO9UmxuqugKMqPMMj3Uq42cqGQgEKhAIACoHCAowgubcCjC2gc8BMN3v1QY?hl=en-IN&gl=IN&ceid=IN%3Aen
NASA greenlights launch of SpaceX's third crew mission to the ISS,https://news.google.com/articles/CAIiEGX2YLLAsHapwdYbBli36SgqFwgEKg8IACoHCAow5v6PATDrwA8wruge?hl=en-IN&gl=IN&ceid=IN%3Aen
"'Is microbial life, including viruses, changing too?'",https://news.google.com/articles/CBMiYWh0dHBzOi8vd3d3LnRyaWJ1bmVpbmRpYS5jb20vbmV3cy9zY2hvb2xzL2lzLW1pY3JvYmlhbC1saWZlLWluY2x1ZGluZy12aXJ1c2VzLWNoYW5naW5nLXRvby0yNDEyNDDSAWFodHRwczovL3d3dy50cmlidW5laW5kaWEuY29tL25ld3Mvc2Nob29scy9pcy1taWNyb2JpYWwtbGlmZS1pbmNsdWRpbmctdmlydXNlcy1jaGFuZ2luZy10b28tMjQxMjQw?hl=en-IN&gl=IN&ceid=IN%3Aen
Fact check: Is coronavirus airborne,https://news.google.com/articles/CAIiEFdSTna-4WJQJRMzt-Yq3mwqFwgEKg8IACoHCAowpIGZAjC7gyEwptA5?hl=en-IN&gl=IN&ceid=IN%3Aen
How to Find COVID-19 Test and Vaccine Centre Info in India via Google Maps,https://news.google.com/articles/CAIiEDpe3VW-oA6vhBEYpqBAG9AqGQgEKhAIACoHCAow5qqNCzD4q58DMPbXpwY?hl=en-IN&gl=IN&ceid=IN%3Aen
Symptoms post COVID recovery may impact daily life Says Experts - Sentinelassam,https://news.google.com/articles/CAIiEJZFBr9EQcwGlIfZSZHbVWoqMwgEKioIACIQmXuAKgvxlxL5xD1y7pCDjioUCAoiEJl7gCoL8ZcS-cQ9cu6Qg44wyezWBg?hl=en-IN&gl=IN&ceid=IN%3Aen
Fauci says U.S. will likely resume use of J&J Covid vaccine with a warning or restriction,https://news.google.com/articles/CAIiEAtbmGvUWLCcBNGY1nUtYjoqGQgEKhAIACoHCAow2Nb3CjDivdcCMJ_5ngY?hl=en-IN&gl=IN&ceid=IN%3Aen
