name,cottage_id,cottage_image,bedrooms,sleeps,rating,price
"Holiday gite in Brittany, shared pool", BI003636_B,https://www.holidayfrancedirect.co.uk/holiday-rentals/BI003636_B/index.htm,Bedrooms 1, Sleeps 3,3,£350 to £400 pw
Holiday cottage rental nr river in Morbihan, BM004861,https://www.holidayfrancedirect.co.uk/holiday-rentals/BM004861/index.htm,Bedrooms 2, Sleeps 4,9.8/10,£420 to £693 pw
Pretty holiday cottage to let in Brittany, BM005126,https://www.holidayfrancedirect.co.uk/holiday-rentals/BM005126/index.htm,Bedrooms 2, Sleeps 6,10/10,£450 to £650 pw
"Stunning gite to let, private pool, Aquitaine", AP007494,https://www.holidayfrancedirect.co.uk/holiday-rentals/AP007494/index.htm,Bedrooms 2, Sleeps 4,4,£450 to £690 pw
Pretty holiday cottage in Brittany, BM005400,https://www.holidayfrancedirect.co.uk/holiday-rentals/BM005400/index.htm,Bedrooms 2, Sleeps 4,9.9/10,£450 to £650 pw
"Holiday farmhouse for 8, Guegon, Brittany", BM005746,https://www.holidayfrancedirect.co.uk/holiday-rentals/BM005746/index.htm,Bedrooms 5, Sleeps 11,11,£734 to £1134 pw
"Gîte Camelia, Gites du Parc, Vendee", LV002900_A,https://www.holidayfrancedirect.co.uk/holiday-rentals/LV002900_A/index.htm,Bedrooms 6, Sleeps 12,9.8/10,€510 to €810 pw
Traditional holiday gite in Brittany, BM002941,https://www.holidayfrancedirect.co.uk/holiday-rentals/BM002941/index.htm,Bedrooms 4, Sleeps 8,10/10,£550 to £1460 pw
Holiday cottage with private pool near Duras, AT004899,https://www.holidayfrancedirect.co.uk/holiday-rentals/AT004899/index.htm,Bedrooms 3, Sleeps 5,5,£500 to £750 pw
Holiday gite with indoor pool in rural Vendee, LV005950,https://www.holidayfrancedirect.co.uk/holiday-rentals/LV005950/index.htm,Bedrooms 2, Sleeps 5,5,£495 to £763 pw
"Lovely gite for couples, Charente Maritime", PM005471,https://www.holidayfrancedirect.co.uk/holiday-rentals/PM005471/index.htm,Bedrooms 1, Sleeps 3,10/10,£280 to £510 pw
One of 4 gites for holiday let Vendee, LV003559_A,https://www.holidayfrancedirect.co.uk/holiday-rentals/LV003559_A/index.htm,Bedrooms 5, Sleeps 11,10/10,£950 to £2150 pw
Large holiday let with pool in rural Dordogne, AD005715,https://www.holidayfrancedirect.co.uk/holiday-rentals/AD005715/index.htm,Bedrooms 4, Sleeps 8,9.7/10,£1400 to £2200 pw
Large holiday gite in rural Aquitaine, AT005900,https://www.holidayfrancedirect.co.uk/holiday-rentals/AT005900/index.htm,Bedrooms 3, Sleeps 6,9.9/10,£575 to £1350 pw
A Cottage for family holiday rental Manche, NM003111,https://www.holidayfrancedirect.co.uk/holiday-rentals/NM003111/index.htm,Bedrooms 3, Sleeps 6,6,£820 to £1579 pw
Self catering farmhouse Brittany, BN003370,https://www.holidayfrancedirect.co.uk/holiday-rentals/BN003370/index.htm,Bedrooms 3, Sleeps 7,9.7/10,£431 to £536 pw
Cosy holiday gite for 2 in Aquitaine, AD004356_C,https://www.holidayfrancedirect.co.uk/holiday-rentals/AD004356_C/index.htm,Bedrooms 1, Sleeps 2,9.9/10,£300 to £525 pw
Holiday cottage rental Brittany coast 10 mins, BM000892_A,https://www.holidayfrancedirect.co.uk/holiday-rentals/BM000892_A/index.htm,Bedrooms 2, Sleeps 4,10/10,£350 to £575 pw
Traditional stone barn to let in Trebons, MH003951,https://www.holidayfrancedirect.co.uk/holiday-rentals/MH003951/index.htm,Bedrooms 1, Sleeps 2,2,£500 pw
Stylish 4* gite with pool in Lot et Garonne, AL006966,https://www.holidayfrancedirect.co.uk/holiday-rentals/AL006966/index.htm,Bedrooms 1, Sleeps 3,10/10,£675 to £850 pw
Lovely disabled,"friendly gite to let, Vienne ",https://www.holidayfrancedirect.co.uk/holiday-rentals/PV006790/index.htm,Bedrooms 5, Sleeps 10,10,£560 to £735 pw
Gite for holiday rental Manche, NM003331_A,https://www.holidayfrancedirect.co.uk/holiday-rentals/NM003331_A/index.htm,Bedrooms 2, Sleeps 7,9.7/10,£395 to £645 pw
Delightful Gite for holiday rental Orne, NO002993_A,https://www.holidayfrancedirect.co.uk/holiday-rentals/NO002993_A/index.htm,Bedrooms 1, Sleeps 3,10/10,£275 to £495 pw
Holiday cottage to let in rural Aquitaine, AT004952,https://www.holidayfrancedirect.co.uk/holiday-rentals/AT004952/index.htm,Bedrooms 2, Sleeps 4,10/10,£580 to £880 pw
Lakeside holiday home for rental in Correze, UH001907,https://www.holidayfrancedirect.co.uk/holiday-rentals/UH001907/index.htm,Bedrooms 4, Sleeps 8,9.5/10,£283 to £525 pw
Cottage to let in small Vendee village, LV004590,https://www.holidayfrancedirect.co.uk/holiday-rentals/LV004590/index.htm,Bedrooms 2, Sleeps 4,4,£300 to £350 pw
"Pretty gite to let in Tremolat, Dordogne", AD007400,https://www.holidayfrancedirect.co.uk/holiday-rentals/AD007400/index.htm,Bedrooms 1, Sleeps 2,2,£415 to £550 pw
Gite to let with a pool in the Vendee, LV007312,https://www.holidayfrancedirect.co.uk/holiday-rentals/LV007312/index.htm,Bedrooms 4, Sleeps 10,10,£580 to £1400 pw
Holiday farmhouse to rent near Dinan, BN001600_B,https://www.holidayfrancedirect.co.uk/holiday-rentals/BN001600_B/index.htm,Bedrooms 2, Sleeps 4,4,£350 to £450 pw
Roomy rural gite to let with pool nr Marmande, AT006567,https://www.holidayfrancedirect.co.uk/holiday-rentals/AT006567/index.htm,Bedrooms 2, Sleeps 5,10/10,£480 to £920 pw
Gite with shared pool in Languedoc, RA005532,https://www.holidayfrancedirect.co.uk/holiday-rentals/RA005532/index.htm,Bedrooms 3, Sleeps 6,6,£490 to £770 pw
Traditional holiday cottage to let near Lot, ML003980,https://www.holidayfrancedirect.co.uk/holiday-rentals/ML003980/index.htm,Bedrooms 3, Sleeps 6,10/10,£630 to £990 pw
"Holiday complex, pool and bar near Lamballe", BN002848_D,https://www.holidayfrancedirect.co.uk/holiday-rentals/BN002848_D/index.htm,Bedrooms 2, Sleeps 4,4,€1000 to €1850 pw
Renovated farmhouse to let in Dordogne, AD005864_D,https://www.holidayfrancedirect.co.uk/holiday-rentals/AD005864_D/index.htm,Bedrooms 2, Sleeps 4,4,€815 to €1235 pw
Character holiday house rural Loire Valley, VE006874,https://www.holidayfrancedirect.co.uk/holiday-rentals/VE006874/index.htm,Bedrooms 3, Sleeps 5,5,£665 pw
Holiday cottage with shared pool near Bourges, VR005402_A,https://www.holidayfrancedirect.co.uk/holiday-rentals/VR005402_A/index.htm,Bedrooms 3, Sleeps 6,6,€744 to €998 pw
Cosy and tranquil holiday cottage with pool, VI004679,https://www.holidayfrancedirect.co.uk/holiday-rentals/VI004679/index.htm,Bedrooms 2, Sleeps 4,9.7/10,£780 to £1195 pw
"Lovely small house, waters edge, Crozon", BF002860_D,https://www.holidayfrancedirect.co.uk/holiday-rentals/BF002860_D/index.htm,Bedrooms 8, Sleeps 18,18,£261 to £711 pw
Cottage for holiday let Pyrenees Atlantiques, AP003204,https://www.holidayfrancedirect.co.uk/holiday-rentals/AP003204/index.htm,Bedrooms 3, Sleeps 5,10/10,£1095 to £1250 pw
Holiday cottages/apartments to let nr Benodet, BF000236_H,https://www.holidayfrancedirect.co.uk/holiday-rentals/BF000236_H/index.htm,Bedrooms 2, Sleeps 5,5,€540 to €960 pw
Gite to let for holidays in rural Brittany, BN005190,https://www.holidayfrancedirect.co.uk/holiday-rentals/BN005190/index.htm,Bedrooms 2, Sleeps 4,9.3/10,£380 to £500 pw
Self catering gite in rural Western Loire, LS003541,https://www.holidayfrancedirect.co.uk/holiday-rentals/LS003541/index.htm,Bedrooms 2, Sleeps 4,10/10,£449 to £999 pw
"Stunning gite to let with pool, Midi Pyrenees", MT007464,https://www.holidayfrancedirect.co.uk/holiday-rentals/MT007464/index.htm,Bedrooms 1, Sleeps 2,2,£200 to £595 pw
Holiday cottage with large pool near Matha, PM006272,https://www.holidayfrancedirect.co.uk/holiday-rentals/PM006272/index.htm,Bedrooms 2, Sleeps 4,4,£295 to £795 pw
Pretty holiday Gite in Poitou,"Charente, pool ",https://www.holidayfrancedirect.co.uk/holiday-rentals/PC004496_B/index.htm,Bedrooms 5, Sleeps 11,9.8/10,£545 to £980 pw
"Tranquil gite with shared pool, Le Gicq", PM005651,https://www.holidayfrancedirect.co.uk/holiday-rentals/PM005651/index.htm,Bedrooms 3, Sleeps 6,10/10,£380 to £1120 pw
Stone farm cottage to let in rural Dordogne, AD003550,https://www.holidayfrancedirect.co.uk/holiday-rentals/AD003550/index.htm,Bedrooms 1, Sleeps 4,9.3/10,£450 to £565 pw
Lovely gite to let on complex in Charente, PC005856,https://www.holidayfrancedirect.co.uk/holiday-rentals/PC005856/index.htm,Bedrooms 5, Sleeps 11,11,£695 to £1800 pw
Large holiday cottage in rural Calvados, NC005640,https://www.holidayfrancedirect.co.uk/holiday-rentals/NC005640/index.htm,Bedrooms 4, Sleeps 8,10/10,£650 to £1100 pw
"Holiday home & pool, short walk to Les Eyzies", AD006131,https://www.holidayfrancedirect.co.uk/holiday-rentals/AD006131/index.htm,Bedrooms 2, Sleeps 4,9.9/10,£530 to £1270 pw
Holiday gite with heated pool in Loire Valley, LL007331,https://www.holidayfrancedirect.co.uk/holiday-rentals/LL007331/index.htm,Bedrooms 5, Sleeps 10,9.8/10,£1250 to £2350 pw
"Stylish 2 bedroom gite to let, rural Dordogne", AD007675,https://www.holidayfrancedirect.co.uk/holiday-rentals/AD007675/index.htm,Bedrooms 2, Sleeps 4,4,£875 to £2950 pw
"Large holiday gite with pool, rural Aquitaine", AT006034_A,https://www.holidayfrancedirect.co.uk/holiday-rentals/AT006034_A/index.htm,Bedrooms 6, Sleeps 12,10/10,£450 to £2100 pw
Holiday gite with large garden in Brittany, BN004377,https://www.holidayfrancedirect.co.uk/holiday-rentals/BN004377/index.htm,Bedrooms 7, Sleeps 16,9.3/10,£995 to £1320 pw
Holiday gite in Brittany, BM006279,https://www.holidayfrancedirect.co.uk/holiday-rentals/BM006279/index.htm,Bedrooms 2, Sleeps 4,4,£500 pw
Holiday cottage and pool to rent Brittany, BM002351_C,https://www.holidayfrancedirect.co.uk/holiday-rentals/BM002351_C/index.htm,Bedrooms 3, Sleeps 5,10/10,£490 to £1385 pw
"Holiday cottage, heated pool, in Brittany", BM007108,https://www.holidayfrancedirect.co.uk/holiday-rentals/BM007108/index.htm,Bedrooms 4, Sleeps 8,8,£995 to £1805 pw
Holiday rental & pool nr St Jean,d'Angély ,https://www.holidayfrancedirect.co.uk/holiday-rentals/PM000398_C/index.htm,Bedrooms 3, Sleeps 9,9,£850 to £1350 pw
Holiday cottage for rental in Brittany, BI003263,https://www.holidayfrancedirect.co.uk/holiday-rentals/BI003263/index.htm,Bedrooms 2, Sleeps 4,9.1/10,£425 to £595 pw
Holiday gite with a pool in the Vendee, LV007339,https://www.holidayfrancedirect.co.uk/holiday-rentals/LV007339/index.htm,Bedrooms 2, Sleeps 4,4,£835 pw
Self catering holiday gite nr Manche, NM003994,https://www.holidayfrancedirect.co.uk/holiday-rentals/NM003994/index.htm,Bedrooms 1, Sleeps 2,9.5/10,£385 pw
Holiday house in Brittany, BM007376,https://www.holidayfrancedirect.co.uk/holiday-rentals/BM007376/index.htm,Bedrooms 4, Sleeps 8,8,£450 to £850 pw
"Large holiday let with private pool, Dordogne", AD005635_B,https://www.holidayfrancedirect.co.uk/holiday-rentals/AD005635_B/index.htm,Bedrooms 4, Sleeps 8,8,£599 to £1599 pw
"Gite for couples to let, Midi Pyrenees", MH004549,https://www.holidayfrancedirect.co.uk/holiday-rentals/MH004549/index.htm,Bedrooms 1, Sleeps 2,10/10,£385 to £495 pw
"Renovated cottage in Cotes d'Armor, Brittany", BN003437,https://www.holidayfrancedirect.co.uk/holiday-rentals/BN003437/index.htm,Bedrooms 1, Sleeps 4,9.8/10,£350 to £570 pw
Cottage for holiday let Charente Maritime, PM003454,https://www.holidayfrancedirect.co.uk/holiday-rentals/PM003454/index.htm,Bedrooms 3, Sleeps 6,6.3/10,£616 to £1365 pw
"Well appointed couples holiday gite, Dordogne", AD006536,https://www.holidayfrancedirect.co.uk/holiday-rentals/AD006536/index.htm,Bedrooms 1, Sleeps 2,2,£300 to £400 pw
Holiday gite with pool in Brittany, BM007324,https://www.holidayfrancedirect.co.uk/holiday-rentals/BM007324/index.htm,Bedrooms 4, Sleeps 6,10/10,€550 to €850 pw
Cosy holiday gite for adults rural Normandy, NM006512,https://www.holidayfrancedirect.co.uk/holiday-rentals/NM006512/index.htm,Bedrooms 2, Sleeps 4,10/10,£469 to £525 pw
Lovely holiday cottage in Correze, UO005079,https://www.holidayfrancedirect.co.uk/holiday-rentals/UO005079/index.htm,Bedrooms 3, Sleeps 5,5,£350 to £500 pw
Tranquil cottage with own pool nr Saintes, PM003177,https://www.holidayfrancedirect.co.uk/holiday-rentals/PM003177/index.htm,Bedrooms 4, Sleeps 6,9.9/10,£1020 to £1360 pw
Village holiday gite in rural Dordogne, AD006516,https://www.holidayfrancedirect.co.uk/holiday-rentals/AD006516/index.htm,Bedrooms 4, Sleeps 7,7,£700 to £1595 pw
Spacious holiday gite to let in Deux Sevres, PS005838,https://www.holidayfrancedirect.co.uk/holiday-rentals/PS005838/index.htm,Bedrooms 2, Sleeps 4,4,£455 pw
Gite for holiday rental in Loire Valley, VI007690,https://www.holidayfrancedirect.co.uk/holiday-rentals/VI007690/index.htm,Bedrooms 2, Sleeps 4,4,£590 to £1050 pw
"Perigordian stone cottage to let, Aquitaine", AD007476_A,https://www.holidayfrancedirect.co.uk/holiday-rentals/AD007476_A/index.htm,Bedrooms 2, Sleeps 4,4,£560 to £900 pw
Holiday cottage with large pool near Matha, PM004717,https://www.holidayfrancedirect.co.uk/holiday-rentals/PM004717/index.htm,Bedrooms 2, Sleeps 4,4,£225 to £725 pw
"Stone cottage to let, views & pool, Aquitaine", AD007476_B,https://www.holidayfrancedirect.co.uk/holiday-rentals/AD007476_B/index.htm,Bedrooms 2, Sleeps 4,10/10,£530 to £870 pw
"Luxury gite to let, private pool, Dordogne", AD007719,https://www.holidayfrancedirect.co.uk/holiday-rentals/AD007719/index.htm,Bedrooms 1, Sleeps 2,2,£770 to £945 pw
Lovely cottage to let in Charente, PC006301,https://www.holidayfrancedirect.co.uk/holiday-rentals/PC006301/index.htm,Bedrooms 2, Sleeps 4,4,£360 pw
Barn Conversion to let in central Burgundy, GC005911,https://www.holidayfrancedirect.co.uk/holiday-rentals/GC005911/index.htm,Bedrooms 3, Sleeps 5,9.9/10,£550 to £650 pw
Holiday cottage to let in the Loire Valley, VI005054,https://www.holidayfrancedirect.co.uk/holiday-rentals/VI005054/index.htm,Bedrooms 2, Sleeps 4,9.8/10,£455 pw
Large property with pool near hamlet of Lage, PS004564,https://www.holidayfrancedirect.co.uk/holiday-rentals/PS004564/index.htm,Bedrooms 4, Sleeps 9,9.7/10,£750 to £1750 pw
Cottage for holiday rental Mayenne, LM003213,https://www.holidayfrancedirect.co.uk/holiday-rentals/LM003213/index.htm,Bedrooms 2, Sleeps 4,8.9/10,£420 pw
Rural holiday gite rental near Moncoutant, PS004762,https://www.holidayfrancedirect.co.uk/holiday-rentals/PS004762/index.htm,Bedrooms 2, Sleeps 4,9.5/10,£300 to £400 pw
"Holiday gite for 2 in rural Normandy, Orne", NO005308,https://www.holidayfrancedirect.co.uk/holiday-rentals/NO005308/index.htm,Bedrooms 1, Sleeps 2,9.4/10,£265 pw
Gite to let near Normandy Landing Beaches, NM005747,https://www.holidayfrancedirect.co.uk/holiday-rentals/NM005747/index.htm,Bedrooms 3, Sleeps 6,10/10,£525 to £885 pw
"La Grange, one of 2 gites, Charente Maritime", PM003662_A,https://www.holidayfrancedirect.co.uk/holiday-rentals/PM003662_A/index.htm,Bedrooms 6, Sleeps 12,12,£650 to £1700 pw
A Cottage for family holiday rental Manche, NM003111,https://www.holidayfrancedirect.co.uk/holiday-rentals/NM003111/index.htm,Bedrooms 3, Sleeps 6,6,£820 to £1579 pw
Lovely cottage to let with pool in Dordogne, AD007592,https://www.holidayfrancedirect.co.uk/holiday-rentals/AD007592/index.htm,Bedrooms 2, Sleeps 5,5,£1675 to £2220 pw
Luxury holiday gite with pool in Aquitaine, AT006134,https://www.holidayfrancedirect.co.uk/holiday-rentals/AT006134/index.htm,Bedrooms 2, Sleeps 5,10/10,£550 to £900 pw
Luxury gite with shared pool to let nr Cognac, PM005505,https://www.holidayfrancedirect.co.uk/holiday-rentals/PM005505/index.htm,Bedrooms 2, Sleeps 4,4,£540 to £865 pw
Aparment to let in Languedoc with shared pool, RH006044,https://www.holidayfrancedirect.co.uk/holiday-rentals/RH006044/index.htm,Bedrooms 2, Sleeps 4,10/10,£500 to £630 pw
Cosy Rural Holiday Gite to let in Brittany, BI005973_D,https://www.holidayfrancedirect.co.uk/holiday-rentals/BI005973_D/index.htm,Bedrooms 2, Sleeps 4,4,€580 to €790 pw
Pet friendly holiday Gite for 2 in Normandy, NM006987,https://www.holidayfrancedirect.co.uk/holiday-rentals/NM006987/index.htm,Bedrooms 1, Sleeps 2,10/10,£400 pw
Holiday cottage rental nr river in Morbihan, BM004861,https://www.holidayfrancedirect.co.uk/holiday-rentals/BM004861/index.htm,Bedrooms 2, Sleeps 4,9.8/10,£420 to £693 pw
Stone house and large pool in Deux Sevres, PS005219,https://www.holidayfrancedirect.co.uk/holiday-rentals/PS005219/index.htm,Bedrooms 7, Sleeps 15,10/10,£1800 to £2500 pw
Farmhouse to let in rural Normandy Calvados, NC005884,https://www.holidayfrancedirect.co.uk/holiday-rentals/NC005884/index.htm,Bedrooms 2, Sleeps 6,6,£595 pw
"Characterful holiday gite & pool, Aquitaine", AT007452,https://www.holidayfrancedirect.co.uk/holiday-rentals/AT007452/index.htm,Bedrooms 3, Sleeps 6,6,£650 to £1100 pw
"Holiday gite with pool, Limousin", US007579,https://www.holidayfrancedirect.co.uk/holiday-rentals/US007579/index.htm,Bedrooms 3, Sleeps 6,6,£1505 pw
Cottage to let in Brittany, BF004487,https://www.holidayfrancedirect.co.uk/holiday-rentals/BF004487/index.htm,Bedrooms 2, Sleeps 4,9.8/10,£180 to £290 pw
Large converted barn to let in Aquitaine, AD003896,https://www.holidayfrancedirect.co.uk/holiday-rentals/AD003896/index.htm,Bedrooms 4, Sleeps 9,10/10,£1200 to £1390 pw
"Large farmhouse & pool to let, Saint Savinien", PM007401,https://www.holidayfrancedirect.co.uk/holiday-rentals/PM007401/index.htm,Bedrooms 4, Sleeps 8,8,£1250 to £1995 pw
Stone House for let nr St Tropez, CV004164,https://www.holidayfrancedirect.co.uk/holiday-rentals/CV004164/index.htm,Bedrooms 3, Sleeps 6,6,£1750 to £1950 pw
"Stunning Rural Gite in Normandy, Orne", NO003444_B,https://www.holidayfrancedirect.co.uk/holiday-rentals/NO003444_B/index.htm,Bedrooms 3, Sleeps 8,10/10,£720 to £1120 pw
Seaside family gite rental 10km Bayeux, NC003265,https://www.holidayfrancedirect.co.uk/holiday-rentals/NC003265/index.htm,Bedrooms 3, Sleeps 6,9.2/10,€895 to €1595 pw
Holiday cottage rental in Brittany, BN000920_C,https://www.holidayfrancedirect.co.uk/holiday-rentals/BN000920_C/index.htm,Bedrooms 11, Sleeps 29,9.8/10,£400 to £2150 pw
Holiday cottage with pool in Lot village, ML006906,https://www.holidayfrancedirect.co.uk/holiday-rentals/ML006906/index.htm,Bedrooms 2, Sleeps 4,4,£1795 to £3000 pw
Holiday cottage with shared pool nr Poitiers, PV005062,https://www.holidayfrancedirect.co.uk/holiday-rentals/PV005062/index.htm,Bedrooms 1, Sleeps 2,9.8/10,£371 to £567 pw
Holiday cottage in rural Vendée, LV003857,https://www.holidayfrancedirect.co.uk/holiday-rentals/LV003857/index.htm,Bedrooms 2, Sleeps 4,4,£400 to £650 pw
"5 Bed Farmhouse to let, heated pool, Lot", ML007218,https://www.holidayfrancedirect.co.uk/holiday-rentals/ML007218/index.htm,Bedrooms 5, Sleeps 10,10,£1495 to £1950 pw
"Large Converted Barn for 10, to let nr Saumur", PV007250,https://www.holidayfrancedirect.co.uk/holiday-rentals/PV007250/index.htm,Bedrooms 4, Sleeps 10,10,£965 to £1900 pw
"Family friendly gite to let with pool, Brux", PV007709,https://www.holidayfrancedirect.co.uk/holiday-rentals/PV007709/index.htm,Bedrooms 2, Sleeps 4,4,£475 to £825 pw
Holiday rental & pool nr St Jean,d'Angély ,https://www.holidayfrancedirect.co.uk/holiday-rentals/PM000398_A/index.htm,Bedrooms 2, Sleeps 5,5,£700 to £950 pw
"Cottage to let in Cotes d'Armor, Brtittany", BN007484_B,https://www.holidayfrancedirect.co.uk/holiday-rentals/BN007484_B/index.htm,Bedrooms 3, Sleeps 6,6,£375 to £485 pw
Large Aquitaine holiday let with private pool, AD005215,https://www.holidayfrancedirect.co.uk/holiday-rentals/AD005215/index.htm,Bedrooms 4, Sleeps 8,10/10,£850 to £1200 pw
"Farmhouse & barn conversion to let, Aquitaine", AD007483,https://www.holidayfrancedirect.co.uk/holiday-rentals/AD007483/index.htm,Bedrooms 6, Sleeps 12,12,£1100 to £2400 pw
"Holiday cottage for 2, Puivert, Languedoc", RA007727,https://www.holidayfrancedirect.co.uk/holiday-rentals/RA007727/index.htm,Bedrooms 1, Sleeps 2,2,£400 pw
Holiday Gite with private pool in Vendee, LV006067,https://www.holidayfrancedirect.co.uk/holiday-rentals/LV006067/index.htm,Bedrooms 2, Sleeps 4,10/10,£450 to £950 pw
"Holiday rural gite, shared pool, near Gomene", BN004658,https://www.holidayfrancedirect.co.uk/holiday-rentals/BN004658/index.htm,Bedrooms 3, Sleeps 7,7,£620 to £965 pw
"Cottage, pool for holiday let in Brittany", BF002047_G,https://www.holidayfrancedirect.co.uk/holiday-rentals/BF002047_G/index.htm,Bedrooms 3, Sleeps 6,9.5/10,£425 to £1225 pw
Lovely gite to let with a pool in the Vendee, LV007718_A,https://www.holidayfrancedirect.co.uk/holiday-rentals/LV007718_A/index.htm,Bedrooms 2, Sleeps 4,4,€390 to €741 pw
Spacious gite to let with pool in Aquitaine, AG005818,https://www.holidayfrancedirect.co.uk/holiday-rentals/AG005818/index.htm,Bedrooms 4, Sleeps 6,9.9/10,€1200 to €1550 pw
Holiday cottage with pool in Brittany, BM005480,https://www.holidayfrancedirect.co.uk/holiday-rentals/BM005480/index.htm,Bedrooms 3, Sleeps 7,9.6/10,£1050 to £1680 pw
Holiday let & pool Loire Valley, VI004218_A,https://www.holidayfrancedirect.co.uk/holiday-rentals/VI004218_A/index.htm,Bedrooms 3, Sleeps 6,6,£595 to £1095 pw
Beautiful gite to let with a pool in Vienne, PV007685,https://www.holidayfrancedirect.co.uk/holiday-rentals/PV007685/index.htm,Bedrooms 5, Sleeps 10,10,£1050 to £1575 pw
Holiday cottage in Brittany, BN007565,https://www.holidayfrancedirect.co.uk/holiday-rentals/BN007565/index.htm,Bedrooms 2, Sleeps 4,4,£334 to £484 pw
Pretty gite for holiday let Vienne, PV003746,https://www.holidayfrancedirect.co.uk/holiday-rentals/PV003746/index.htm,Bedrooms 1, Sleeps 5,5,£650 pw
Holiday let set in Normandy manor's gounds, NC004781_A,https://www.holidayfrancedirect.co.uk/holiday-rentals/NC004781_A/index.htm,Bedrooms 3, Sleeps 7,9.7/10,€700 pw
Relaxing large gite to let in Brittany, BF007407,https://www.holidayfrancedirect.co.uk/holiday-rentals/BF007407/index.htm,Bedrooms 5, Sleeps 10,10,£425 to £799 pw
Lovely converted barn with pool in Charente, PC006897,https://www.holidayfrancedirect.co.uk/holiday-rentals/PC006897/index.htm,Bedrooms 5, Sleeps 10,10,£850 to £1950 pw
"Holiday barn to let nr Rostrenen, Brittany", BN002868,https://www.holidayfrancedirect.co.uk/holiday-rentals/BN002868/index.htm,Bedrooms 4, Sleeps 6,6,£300 to £480 pw
"Holiday cottage with shared pool, Aquitaine", AT007460,https://www.holidayfrancedirect.co.uk/holiday-rentals/AT007460/index.htm,Bedrooms 1, Sleeps 2,2,£480 to £595 pw
"Lovely gite with pool to let, Charente", PC006531,https://www.holidayfrancedirect.co.uk/holiday-rentals/PC006531/index.htm,Bedrooms 2, Sleeps 4,4,£450 to £585 pw
Lovely 1 bedroom gite to let in Aquitaine, AD004356_E,https://www.holidayfrancedirect.co.uk/holiday-rentals/AD004356_E/index.htm,Bedrooms 1, Sleeps 2,10/10,£330 to £600 pw
Self catering holiday cottage in Brittany, BI003960_B,https://www.holidayfrancedirect.co.uk/holiday-rentals/BI003960_B/index.htm,Bedrooms 1, Sleeps 3,3,£375 to £400 pw
"Holiday cottage for 2, near Albi", MT004965,https://www.holidayfrancedirect.co.uk/holiday-rentals/MT004965/index.htm,Bedrooms 1, Sleeps 2,9.9/10,£460 to £510 pw
Holiday cottage for 4 in rural Normandy, NM005381,https://www.holidayfrancedirect.co.uk/holiday-rentals/NM005381/index.htm,Bedrooms 2, Sleeps 4,10/10,£475 to £795 pw
"Spacious holiday house to let, rural Vendee", LV006299,https://www.holidayfrancedirect.co.uk/holiday-rentals/LV006299/index.htm,Bedrooms 5, Sleeps 10,9.8/10,£799 to £995 pw
Large holiday let with pool nr Bergerac, AT005397,https://www.holidayfrancedirect.co.uk/holiday-rentals/AT005397/index.htm,Bedrooms 5, Sleeps 12,9.4/10,£2000 to £2600 pw
Holiday cottage rental Brittany coast 10 mins, BM000892_C,https://www.holidayfrancedirect.co.uk/holiday-rentals/BM000892_C/index.htm,Bedrooms 3, Sleeps 4,10/10,£350 to £575 pw
Traditional gite to let in rural Normandy, NO004980,https://www.holidayfrancedirect.co.uk/holiday-rentals/NO004980/index.htm,Bedrooms 2, Sleeps 6,10/10,£300 to £550 pw
Beautiful gite to let with a pool in Vienne, PV007677_A,https://www.holidayfrancedirect.co.uk/holiday-rentals/PV007677_A/index.htm,Bedrooms 6, Sleeps 12,12,£450 to £950 pw
Lovely two bed gite to let in Charente, PC007189,https://www.holidayfrancedirect.co.uk/holiday-rentals/PC007189/index.htm,Bedrooms 2, Sleeps 4,4,£420 to £700 pw
Lovely Gite close to the Gironde and Coast, PM005665,https://www.holidayfrancedirect.co.uk/holiday-rentals/PM005665/index.htm,Bedrooms 3, Sleeps 6,10/10,£725 to £1195 pw
Cosy holiday cottage in rural setting, Indre ,https://www.holidayfrancedirect.co.uk/holiday-rentals/VE004547/index.htm,Bedrooms 2, Sleeps 4,9.7/10,£350 to £390 pw
Gite to let in Normandy/Pays de Loire, LS005012,https://www.holidayfrancedirect.co.uk/holiday-rentals/LS005012/index.htm,Bedrooms 4, Sleeps 9,9,£700 pw
Lovely holiday let with a pool in Macqueville, PM007707,https://www.holidayfrancedirect.co.uk/holiday-rentals/PM007707/index.htm,Bedrooms 6, Sleeps 12,12,£700 to £2800 pw
Large house with pool to let in Dordogne, AD007593,https://www.holidayfrancedirect.co.uk/holiday-rentals/AD007593/index.htm,Bedrooms 5, Sleeps 11,11,£3545 to £3975 pw
"Pretty Holiday Barn Conversion & pool, Cersay", PS007241,https://www.holidayfrancedirect.co.uk/holiday-rentals/PS007241/index.htm,Bedrooms 2, Sleeps 5,5,£595 to £750 pw
Holiday cottages to let in Normandy, NO007232,https://www.holidayfrancedirect.co.uk/holiday-rentals/NO007232/index.htm,Bedrooms 3, Sleeps 6,6,£536 to £902 pw
Holiday gite in rural Normandy Manche, NM006168,https://www.holidayfrancedirect.co.uk/holiday-rentals/NM006168/index.htm,Bedrooms 2, Sleeps 6,9.8/10,£595 to £650 pw
Gite for holiday rental in Brittany, BM003311,https://www.holidayfrancedirect.co.uk/holiday-rentals/BM003311/index.htm,Bedrooms 5, Sleeps 12,8.6/10,£900 to £1850 pw
Holiday cottage & pool to let nr Pont,Aven ,https://www.holidayfrancedirect.co.uk/holiday-rentals/BF002047_E/index.htm,Bedrooms 3, Sleeps 6,9.9/10,£425 to £1225 pw
